{"$schema":"https://json-schema.org/draft/2020-12/schema","$id":"urn:open-brain:portable-brain:v1:capture","type":"object","properties":{"accepted_at":{"$ref":"urn:open-brain:portable-brain:v1:common#/$defs/timestamp"},"actor_id":{"$ref":"urn:open-brain:portable-brain:v1:common#/$defs/actor_id"},"capture_id":{"$ref":"urn:open-brain:portable-brain:v1:common#/$defs/capture_id"},"capture_why":{"type":["string","null"]},"intent":{"type":["string","null"]},"original_payload":{"oneOf":[{"type":"object","properties":{"bytes_base64":{"type":"string","minLength":1},"kind":{"const":"inline"},"sha256":{"$ref":"urn:open-brain:portable-brain:v1:common#/$defs/digest"}},"required":["bytes_base64","kind","sha256"],"additionalProperties":false},{"type":"object","properties":{"blob_sha256":{"$ref":"urn:open-brain:portable-brain:v1:common#/$defs/digest"},"kind":{"const":"blob"}},"required":["blob_sha256","kind"],"additionalProperties":false}]},"payload":{"oneOf":[{"$ref":"urn:open-brain:portable-brain:v1:text"},{"$ref":"urn:open-brain:portable-brain:v1:reference-or-file"},{"$ref":"urn:open-brain:portable-brain:v1:event"},{"$ref":"urn:open-brain:portable-brain:v1:measurement"}]},"payload_binding":{"oneOf":[{"type":"object","properties":{"kind":{"const":"inline"},"payload_sha256":{"$ref":"urn:open-brain:portable-brain:v1:common#/$defs/digest"}},"required":["kind","payload_sha256"],"additionalProperties":false},{"type":"object","properties":{"batch_id":{"$ref":"urn:open-brain:portable-brain:v1:common#/$defs/batch_id"},"kind":{"const":"batch"},"record_id":{"oneOf":[{"$ref":"urn:open-brain:portable-brain:v1:common#/$defs/event_id"},{"$ref":"urn:open-brain:portable-brain:v1:common#/$defs/measurement_id"}]}},"required":["batch_id","kind","record_id"],"additionalProperties":false}]},"payload_schema_version":{"const":1},"privacy":{"$ref":"urn:open-brain:portable-brain:v1:common#/$defs/privacy"},"provenance":{"$ref":"urn:open-brain:portable-brain:v1:common#/$defs/provenance"},"receipt_refs":{"type":"array","minItems":1,"items":{"$ref":"urn:open-brain:portable-brain:v1:common#/$defs/receipt"},"uniqueItems":true},"role_claim":{"$ref":"urn:open-brain:portable-brain:v1:common#/$defs/role_claim"},"schema_version":{"const":1},"source":{"type":"object","properties":{"origin":{"enum":["owner","third_party"]},"reference":{"type":"string","minLength":1}},"required":["origin","reference"],"additionalProperties":false},"space_id":{"oneOf":[{"$ref":"urn:open-brain:portable-brain:v1:common#/$defs/space_id"},{"type":"null"}]},"tenant_id":{"$ref":"urn:open-brain:portable-brain:v1:common#/$defs/tenant_id"},"trust":{"$ref":"urn:open-brain:portable-brain:v1:common#/$defs/trust"}},"required":["accepted_at","actor_id","capture_id","capture_why","intent","original_payload","payload","payload_binding","payload_schema_version","privacy","provenance","receipt_refs","role_claim","schema_version","source","space_id","tenant_id","trust"],"additionalProperties":false}
