{"accepted_at":"2026-08-30T12:01:00Z","actor_id":"actor_123e4567-e89b-42d3-a456-426614174001","capture_id":"capture_123e4567-e89b-42d3-a456-426614174101","capture_why":null,"intent":null,"original_payload":{"blob_sha256":"ea8df5c802b7fcb7c952e1b143ee8d2670e7d8b8ae8843af2ce4f55e3e1ded49","kind":"blob"},"payload":{"blob_sha256":"ea8df5c802b7fcb7c952e1b143ee8d2670e7d8b8ae8843af2ce4f55e3e1ded49","family":"reference_or_file","file_name":"fixture.txt","kind":"file","media_type":"text/plain"},"payload_binding":{"kind":"inline","payload_sha256":"6f9f9054e26f0b7a926544083c8e8aba5dd67f7a2a7d8dc7e36f2a1ee265d68a"},"payload_schema_version":1,"privacy":{"authority":{"cloud":false,"external_egress":false},"confirmation_ref":null,"policy_version":"privacy-v1","reason":"personal_local_only","tier":"personal"},"provenance":{"content_origin":"owner_authored","owner_context":"owner_authored","source_ref":"urn:example.invalid:portable-fixture","transformation_receipts":[]},"receipt_refs":[{"kind":"capture_accepted","payload":{"capture_id":"capture_123e4567-e89b-42d3-a456-426614174101","original_payload_sha256":"ea8df5c802b7fcb7c952e1b143ee8d2670e7d8b8ae8843af2ce4f55e3e1ded49","payload_sha256":"6f9f9054e26f0b7a926544083c8e8aba5dd67f7a2a7d8dc7e36f2a1ee265d68a"},"receipt_id":"receipt_123e4567-e89b-42d3-a456-426614174111","recorded_at":"2026-08-30T12:00:00Z","sha256":"873435ce452ffef59c40265aee895628b4cbbb3e14d4557126b2740111674830","subject_id":"capture_123e4567-e89b-42d3-a456-426614174101"}],"role_claim":{"actor_id":"actor_123e4567-e89b-42d3-a456-426614174001","capabilities":["capture.accept","space.write"],"role_claim_id":"role_claim_123e4567-e89b-42d3-a456-426614174003","role_id":"role_123e4567-e89b-42d3-a456-426614174002","tenant_id":"tenant_123e4567-e89b-42d3-a456-426614174000"},"schema_version":1,"source":{"origin":"owner","reference":"urn:example.invalid:portable-fixture"},"space_id":null,"tenant_id":"tenant_123e4567-e89b-42d3-a456-426614174000","trust":{"assessed_at":"2026-08-30T12:00:00Z","assessor_actor_id":"actor_123e4567-e89b-42d3-a456-426614174001","label":"owner","reason":"owner supplied synthetic fixture"}}