{"accepted_at":"2026-08-30T12:03:00Z","actor_id":"actor_123e4567-e89b-42d3-a456-426614174001","capture_id":"capture_123e4567-e89b-42d3-a456-426614174103","capture_why":null,"intent":null,"original_payload":{"bytes_base64":"eyJkaW1lbnNpb25zIjpbeyJuYW1lIjoic291cmNlIiwidmFsdWUiOiJzeW50aGV0aWMifV0sImZhbWlseSI6Im1lYXN1cmVtZW50Iiwib2NjdXJyZW5jZV9hdCI6IjIwMjYtMDgtMzBUMTI6MDE6MDBaIiwidW5pdCI6ImtnIiwidmFsdWUiOiIwLjUifQ==","kind":"inline","sha256":"f1836f6288ad6f18cd19b981857c6fe19f71101938d27f9ac7c4f0b8713e8ea5"},"payload":{"dimensions":[{"name":"source","value":"synthetic"}],"family":"measurement","occurrence_at":"2026-08-30T12:01:00Z","unit":"kg","value":"0.5"},"payload_binding":{"batch_id":"batch_123e4567-e89b-42d3-a456-426614174007","kind":"batch","record_id":"measurement_123e4567-e89b-42d3-a456-426614174070"},"payload_schema_version":1,"privacy":{"authority":{"cloud":false,"external_egress":false},"confirmation_ref":null,"policy_version":"privacy-v1","reason":"personal_local_only","tier":"personal"},"provenance":{"content_origin":"owner_authored","owner_context":"owner_authored","source_ref":"urn:example.invalid:portable-fixture","transformation_receipts":[]},"receipt_refs":[{"kind":"capture_accepted","payload":{"capture_id":"capture_123e4567-e89b-42d3-a456-426614174103","original_payload_sha256":"f1836f6288ad6f18cd19b981857c6fe19f71101938d27f9ac7c4f0b8713e8ea5","payload_sha256":"f1836f6288ad6f18cd19b981857c6fe19f71101938d27f9ac7c4f0b8713e8ea5"},"receipt_id":"receipt_123e4567-e89b-42d3-a456-426614174113","recorded_at":"2026-08-30T12:00:00Z","sha256":"2d5192098c0cc5a51298ca8fd45bdc0fabeb85f6c10e7f181bc1762072ca39ac","subject_id":"capture_123e4567-e89b-42d3-a456-426614174103"}],"role_claim":{"actor_id":"actor_123e4567-e89b-42d3-a456-426614174001","capabilities":["capture.accept","space.write"],"role_claim_id":"role_claim_123e4567-e89b-42d3-a456-426614174003","role_id":"role_123e4567-e89b-42d3-a456-426614174002","tenant_id":"tenant_123e4567-e89b-42d3-a456-426614174000"},"schema_version":1,"source":{"origin":"owner","reference":"urn:example.invalid:portable-fixture"},"space_id":"space_123e4567-e89b-42d3-a456-426614174004","tenant_id":"tenant_123e4567-e89b-42d3-a456-426614174000","trust":{"assessed_at":"2026-08-30T12:00:00Z","assessor_actor_id":"actor_123e4567-e89b-42d3-a456-426614174001","label":"owner","reason":"owner supplied synthetic fixture"}}