{"accepted_at":"2026-08-30T12:02:00Z","actor_id":"actor_123e4567-e89b-42d3-a456-426614174001","capture_id":"capture_123e4567-e89b-42d3-a456-426614174102","capture_why":null,"intent":null,"original_payload":{"bytes_base64":"eyJhdHRyaWJ1dGVzIjpbeyJuYW1lIjoicmVwb3NpdG9yeSIsInZhbHVlIjoib3Blbi1icmFpbiJ9XSwiZXZlbnRfdHlwZSI6ImNvbW1pdC5jcmVhdGVkIiwiZmFtaWx5IjoiZXZlbnQiLCJvY2N1cnJlbmNlX2F0IjoiMjAyNi0wOC0zMFQxMjowMDowMFoifQ==","kind":"inline","sha256":"668eb0632e0deb74dee71bceb9ec3bfd31cc023d6028c74b4b83827269d7f98c"},"payload":{"attributes":[{"name":"repository","value":"open-brain"}],"event_type":"commit.created","family":"event","occurrence_at":"2026-08-30T12:00:00Z"},"payload_binding":{"batch_id":"batch_123e4567-e89b-42d3-a456-426614174006","kind":"batch","record_id":"event_123e4567-e89b-42d3-a456-426614174060"},"payload_schema_version":1,"privacy":{"authority":{"cloud":false,"external_egress":false},"confirmation_ref":null,"policy_version":"privacy-v1","reason":"personal_local_only","tier":"personal"},"provenance":{"content_origin":"owner_authored","owner_context":"owner_authored","source_ref":"urn:example.invalid:portable-fixture","transformation_receipts":[]},"receipt_refs":[{"kind":"capture_accepted","payload":{"capture_id":"capture_123e4567-e89b-42d3-a456-426614174102","original_payload_sha256":"668eb0632e0deb74dee71bceb9ec3bfd31cc023d6028c74b4b83827269d7f98c","payload_sha256":"668eb0632e0deb74dee71bceb9ec3bfd31cc023d6028c74b4b83827269d7f98c"},"receipt_id":"receipt_123e4567-e89b-42d3-a456-426614174112","recorded_at":"2026-08-30T12:00:00Z","sha256":"9907a5b424815df6878f22a7b380b3187860d183d8bcb4c18f7007d77322b68b","subject_id":"capture_123e4567-e89b-42d3-a456-426614174102"}],"role_claim":{"actor_id":"actor_123e4567-e89b-42d3-a456-426614174001","capabilities":["capture.accept","space.write"],"role_claim_id":"role_claim_123e4567-e89b-42d3-a456-426614174003","role_id":"role_123e4567-e89b-42d3-a456-426614174002","tenant_id":"tenant_123e4567-e89b-42d3-a456-426614174000"},"schema_version":1,"source":{"origin":"owner","reference":"urn:example.invalid:portable-fixture"},"space_id":"space_123e4567-e89b-42d3-a456-426614174004","tenant_id":"tenant_123e4567-e89b-42d3-a456-426614174000","trust":{"assessed_at":"2026-08-30T12:00:00Z","assessor_actor_id":"actor_123e4567-e89b-42d3-a456-426614174001","label":"owner","reason":"owner supplied synthetic fixture"}}