{"accepted_at":"2026-08-30T12:00:00Z","actor_id":"actor_123e4567-e89b-42d3-a456-426614174001","capture_id":"capture_123e4567-e89b-42d3-a456-426614174100","capture_why":"synthetic fixture","intent":"idea","original_payload":{"bytes_base64":"eyJmYW1pbHkiOiJ0ZXh0IiwidGV4dCI6IlBvcnRhYmxlIEJyYWluIHN5bnRoZXRpYyB0ZXh0LiJ9","kind":"inline","sha256":"3a7ba46feaf034aa0ccc2abb6961d527b09a8ab50dd57e6b0cd8bba14127b1ef"},"payload":{"family":"text","text":"Portable Brain synthetic text."},"payload_binding":{"kind":"inline","payload_sha256":"3a7ba46feaf034aa0ccc2abb6961d527b09a8ab50dd57e6b0cd8bba14127b1ef"},"payload_schema_version":1,"privacy":{"authority":{"cloud":false,"external_egress":false},"confirmation_ref":null,"policy_version":"privacy-v1","reason":"personal_local_only","tier":"personal"},"provenance":{"content_origin":"owner_authored","owner_context":"owner_authored","source_ref":"urn:example.invalid:portable-fixture","transformation_receipts":[]},"receipt_refs":[{"kind":"capture_accepted","payload":{"capture_id":"capture_123e4567-e89b-42d3-a456-426614174100","original_payload_sha256":"3a7ba46feaf034aa0ccc2abb6961d527b09a8ab50dd57e6b0cd8bba14127b1ef","payload_sha256":"3a7ba46feaf034aa0ccc2abb6961d527b09a8ab50dd57e6b0cd8bba14127b1ef"},"receipt_id":"receipt_123e4567-e89b-42d3-a456-426614174110","recorded_at":"2026-08-30T12:00:00Z","sha256":"ad79839271b3067f74cc49eee03d4a8e1a3bf0d24a08d3fe97cfde30faeb1352","subject_id":"capture_123e4567-e89b-42d3-a456-426614174100"}],"role_claim":{"actor_id":"actor_123e4567-e89b-42d3-a456-426614174001","capabilities":["capture.accept","space.write"],"role_claim_id":"role_claim_123e4567-e89b-42d3-a456-426614174003","role_id":"role_123e4567-e89b-42d3-a456-426614174002","tenant_id":"tenant_123e4567-e89b-42d3-a456-426614174000"},"schema_version":1,"source":{"origin":"owner","reference":"urn:example.invalid:portable-fixture"},"space_id":"space_123e4567-e89b-42d3-a456-426614174004","tenant_id":"tenant_123e4567-e89b-42d3-a456-426614174000","trust":{"assessed_at":"2026-08-30T12:00:00Z","assessor_actor_id":"actor_123e4567-e89b-42d3-a456-426614174001","label":"owner","reason":"owner supplied synthetic fixture"}}